{
  "schemaVersion": "1.0.0",
  "eventId": "hsgn-innovation-niacinamide-launch",
  "topic": "hsgn-innovation-niacinamide-launch",
  "scopePolicy": "exact_event_or_explicit_topic",
  "industry": "cosmetics_skincare",
  "status": "ready",
  "minimumSelectedSignals": 3,
  "selectedSignalCount": 4,
  "targetHypotheses": [
    "Mobile viewers who need to understand a new product at a glance",
    "Customers who compare ingredient labels and product composition before choosing a new skincare product",
    "Customers who want to confirm a product name and ingredient concentration before purchase",
    "Customers considering whether to explore a newly released skincare product"
  ],
  "customerPains": [
    "Start with a clear choice criterion for ingredient-conscious customers, then introduce the new product without promising a skin result."
  ],
  "customerDesires": [],
  "purchaseObjections": [],
  "trendHooks": [],
  "seasonalHooks": [
    "Present the new-product reveal as a timely invitation to inspect the product information, not as a discount or limited-stock message."
  ],
  "productProofs": [
    "The launch creative can make the verified product name and 100,000ppm label the reason to inspect the product detail, without adding benefit claims."
  ],
  "offerAngles": [],
  "channelPatterns": [
    "Keep the hero visual product-led with a calm headline-safe area; the orange cap is a restrained brand accent rather than a promotional device."
  ],
  "evidenceDetails": [
    {
      "signalId": "hsgn-innovation-launch-channel",
      "evidenceType": "channel_pattern",
      "targetSegment": "Mobile viewers who need to understand a new product at a glance",
      "insight": "Keep the hero visual product-led with a calm headline-safe area; the orange cap is a restrained brand accent rather than a promotional device.",
      "sourceType": "internal",
      "sourceName": "Brand visual guide",
      "observedAt": "2026-07-26",
      "claimBoundary": "Visual direction only; do not use as efficacy evidence."
    },
    {
      "signalId": "hsgn-innovation-launch-pain",
      "evidenceType": "pain",
      "targetSegment": "Customers who compare ingredient labels and product composition before choosing a new skincare product",
      "insight": "Start with a clear choice criterion for ingredient-conscious customers, then introduce the new product without promising a skin result.",
      "sourceType": "internal",
      "sourceName": "Event input target",
      "observedAt": "2026-07-26",
      "claimBoundary": "Audience selection context only; not a performance claim."
    },
    {
      "signalId": "hsgn-innovation-launch-proof",
      "evidenceType": "proof",
      "targetSegment": "Customers who want to confirm a product name and ingredient concentration before purchase",
      "insight": "The launch creative can make the verified product name and 100,000ppm label the reason to inspect the product detail, without adding benefit claims.",
      "sourceType": "internal",
      "sourceName": "Product library",
      "observedAt": "2026-07-26",
      "claimBoundary": "Use only the product name and stated niacinamide concentration; do not infer efficacy."
    },
    {
      "signalId": "hsgn-innovation-launch-timing",
      "evidenceType": "timing",
      "targetSegment": "Customers considering whether to explore a newly released skincare product",
      "insight": "Present the new-product reveal as a timely invitation to inspect the product information, not as a discount or limited-stock message.",
      "sourceType": "internal",
      "sourceName": "Event schedule",
      "observedAt": "2026-07-26",
      "claimBoundary": "Launch dates describe campaign timing only; no sale or scarcity claim."
    }
  ],
  "doNotClaim": [
    "사람이 선택한 근거에 없는 순위, 가격, 효능, 기간 수치를 만들지 않는다.",
    "무작위 가설은 사람이 검수하기 전까지 사실 근거로 사용하지 않는다.",
    "공식 출처가 없는 유행, 날씨, 판매 순위 주장을 단정하지 않는다."
  ],
  "evidenceSignalIds": [
    "hsgn-innovation-launch-channel",
    "hsgn-innovation-launch-pain",
    "hsgn-innovation-launch-proof",
    "hsgn-innovation-launch-timing"
  ],
  "createdAt": "2026-07-26T01:45:12.903973+00:00"
}
