{
  "schemaVersion": "1.0.0",
  "eventId": "promotion-gift",
  "topic": "hydration_ampoule_gift",
  "scopePolicy": "exact_event_or_explicit_topic",
  "industry": "cosmetics_skincare",
  "status": "ready",
  "minimumSelectedSignals": 3,
  "selectedSignalCount": 3,
  "targetHypotheses": [
    "새 루틴을 부담 없이 시작하려는 고객",
    "사은품보다 본품 가치와 증정 이유를 먼저 따지는 고객",
    "할인보다 루틴을 시험할 추가 가치를 원하는 고객"
  ],
  "customerPains": [],
  "customerDesires": [
    "미니 크림 증정은 무조건 큰 혜택이라고 단정하지 말고, 앰플과 함께 새 루틴을 시험할 수 있는 보완 가치로 설명한다."
  ],
  "purchaseObjections": [
    "수분 앰플과 미니 크림이 같은 루틴에서 어떤 역할을 나누는지 먼저 설명하고 사은품 크기만 강조하지 않는다."
  ],
  "trendHooks": [],
  "seasonalHooks": [],
  "productProofs": [],
  "offerAngles": [
    "혜택은 입력된 증정 조건까지만 표현하고 기간, 수량, 할인율, 선착순 조건은 추가로 만들지 않는다."
  ],
  "channelPatterns": [],
  "evidenceDetails": [
    {
      "signalId": "public_signal_d999411dfa885aa4",
      "evidenceType": "offer",
      "targetSegment": "새 루틴을 부담 없이 시작하려는 고객",
      "insight": "혜택은 입력된 증정 조건까지만 표현하고 기간, 수량, 할인율, 선착순 조건은 추가로 만들지 않는다.",
      "sourceType": "internal",
      "sourceName": "화장품 고정 평가 이벤트 입력",
      "observedAt": "2026-07-01",
      "claimBoundary": ""
    },
    {
      "signalId": "public_signal_e0de4ff7134ee2f3",
      "evidenceType": "objection",
      "targetSegment": "사은품보다 본품 가치와 증정 이유를 먼저 따지는 고객",
      "insight": "수분 앰플과 미니 크림이 같은 루틴에서 어떤 역할을 나누는지 먼저 설명하고 사은품 크기만 강조하지 않는다.",
      "sourceType": "public_web",
      "sourceName": "European Journal of Marketing",
      "observedAt": "2026-07-01",
      "claimBoundary": ""
    },
    {
      "signalId": "public_signal_cdba34816001d2bf",
      "evidenceType": "desire",
      "targetSegment": "할인보다 루틴을 시험할 추가 가치를 원하는 고객",
      "insight": "미니 크림 증정은 무조건 큰 혜택이라고 단정하지 말고, 앰플과 함께 새 루틴을 시험할 수 있는 보완 가치로 설명한다.",
      "sourceType": "public_web",
      "sourceName": "Journal of Consumer Psychology",
      "observedAt": "2026-07-01",
      "claimBoundary": ""
    }
  ],
  "doNotClaim": [
    "사람이 선택한 근거에 없는 순위, 가격, 효능, 기간 수치를 만들지 않는다.",
    "무작위 가설은 사람이 검수하기 전까지 사실 근거로 사용하지 않는다.",
    "공식 출처가 없는 유행, 날씨, 판매 순위 주장을 단정하지 않는다."
  ],
  "evidenceSignalIds": [
    "public_signal_d999411dfa885aa4",
    "public_signal_e0de4ff7134ee2f3",
    "public_signal_cdba34816001d2bf"
  ],
  "createdAt": "2026-07-20T13:55:19.930712+00:00"
}
